{
  "artifact_type": "MERGE_CANDIDATE_FREEZE",
  "freeze_version": 4,
  "owner": "WEB_BRAIN",
  "status": "FROZEN_FOR_USER_DECISIONS",
  "project_id": "JOYFLOW_DEVELOPMENT",
  "task_id": "TASK_PHASE1E_AI_NATIVE_CHANGE_PROJECTION_REPAIR",
  "round_id": 1,
  "repository_id": "example/repo",
  "pr_number": 42,
  "base_sha": "03d691ce70c8703e6e719e1063c01040f405894f",
  "head_sha": "f8a5f006b48461efacd6573638d0ee74af1bcd53",
  "pr_body_digest": "221e3dceaa575133af775b62442768fef6621e42c477c337362834f90a3c59e7",
  "pr_record_digest": "8edf2b8928a07a0be71e43756327b87c19d31c08d4ff8097724177702dbe7f69",
  "pr_ci_result_digest": "8079765a27520542b1f6c95bee45ea4343668affa15d78d483f1178452678d8d",
  "projection_digest": "8e67cc6387cae209a5579bf8fe2e94832fdbb35ec9e35648dbe39917ffe17fb6",
  "codex_return_digest": "9d53f28f01509a8d0d384cc851bf4e1acf47a7eef371c3a193c75ba22ac84724",
  "evidence_bundle_digest": "873da4b0e36030626636ea5b7589cd62a5a3e3ee9b907b2bbd880c3e9de47bca",
  "brain_review_capsule_digest": "9d6006d72053faef13172b5e7be4d4cb1f521e93d6fb02fe59913c35512b75a9",
  "unresolved_items": [],
  "freeze_digest": "6c1ca6b831827c19648c891b3341352e29cd91188935ad9d3418d6cb14780070"
}
